{
  "assignment": "Problem Set 3",
  "studentName": "Ben Ladetsky",
  "projectTitle": "Digital Kitchen",
  "description": "Browse shared recipes, track your own groceries, and record meals while keeping ingredient quantities up to date. Google sign-in separates personal kitchen activity from owner-managed recipes.",
  "projectType": ["Web App"],
  "projectUrl": "https://si212-assignments-bladetsk.onrender.com",
  "tags": ["React", "Express", "Postgres"]
}
